{"bindings":[{"allowedClasses":["D0","D1","D2","D3"],"channelId":"private-bridge-out","contextCommitment":"80326cda8c0bfd673e638c95b1618ffcaca2eeffcd81701e93139748bdeb783f","direction":"outbound","expectedPinsetId":"bridge-out-remote-pinset","id":"bridge-out-binding","localEndpointId":"bridge-out-local-endpoint","localPrincipalId":"bridge-out-origin","remoteEndpointId":"bridge-out-remote-endpoint","remotePrincipalId":"bridge-out-peer","state":"structural-only","transportProfileId":"bridge-out-transport-v1"},{"allowedClasses":["D0","D1","D2","D3"],"channelId":"private-bridge-return","contextCommitment":"033fc8e5ff1e3f139ee913dc2597711e8631b1b94cc1a799093178553d140001","direction":"inbound","expectedPinsetId":"bridge-return-remote-pinset","id":"bridge-return-binding","localEndpointId":"bridge-return-local-endpoint","localPrincipalId":"bridge-return-receiver","remoteEndpointId":"bridge-return-remote-endpoint","remotePrincipalId":"bridge-return-peer","state":"structural-only","transportProfileId":"bridge-return-transport-v1"},{"allowedClasses":["D4"],"channelId":"restricted-review","contextCommitment":"177684d92fe7eb90a513a9754982c305b7a4118f0724dfe0a69c1189b38b5f91","direction":"bidirectional","expectedPinsetId":"restricted-review-remote-pinset","id":"restricted-review-binding","localEndpointId":"restricted-review-local-endpoint","localPrincipalId":"restricted-review-origin","remoteEndpointId":"restricted-review-remote-endpoint","remotePrincipalId":"restricted-review-peer","state":"structural-only","transportProfileId":"restricted-review-transport-v1"}],"endpoints":[{"channelId":"private-bridge-out","expectedPrincipalId":"bridge-out-origin","id":"bridge-out-local-endpoint","locator":null,"locatorState":"unbound","operationalState":"planned","pinsetId":null,"purpose":"origin","side":"local"},{"channelId":"private-bridge-out","expectedPrincipalId":"bridge-out-peer","id":"bridge-out-remote-endpoint","locator":null,"locatorState":"unbound","operationalState":"planned","pinsetId":"bridge-out-remote-pinset","purpose":"peer","side":"remote"},{"channelId":"private-bridge-return","expectedPrincipalId":"bridge-return-receiver","id":"bridge-return-local-endpoint","locator":null,"locatorState":"unbound","operationalState":"planned","pinsetId":null,"purpose":"receiver","side":"local"},{"channelId":"private-bridge-return","expectedPrincipalId":"bridge-return-peer","id":"bridge-return-remote-endpoint","locator":null,"locatorState":"unbound","operationalState":"planned","pinsetId":"bridge-return-remote-pinset","purpose":"peer","side":"remote"},{"channelId":"restricted-review","expectedPrincipalId":"restricted-review-origin","id":"restricted-review-local-endpoint","locator":null,"locatorState":"unbound","operationalState":"planned","pinsetId":null,"purpose":"origin","side":"local"},{"channelId":"restricted-review","expectedPrincipalId":"restricted-review-peer","id":"restricted-review-remote-endpoint","locator":null,"locatorState":"unbound","operationalState":"planned","pinsetId":"restricted-review-remote-pinset","purpose":"peer","side":"remote"}],"pinsets":[{"algorithm":"sha256","commitment":"11e80a9fdaeeb6fed8ee3f94182ffb84258d6afe5904e758ca75023227fdf90f","endpointId":"bridge-out-remote-endpoint","id":"bridge-out-remote-pinset","pins":["20a590a15a5a54e26619d225a141706c2ae47da4224521541f5dab81a48ae562","2ac7103133dc544bf7088723a20f69ec776ee9ed4d1ae99548f228989ed766dc"],"synthetic":true},{"algorithm":"sha256","commitment":"cdf1b429c74979d07701a1b128f1d7ebd607043e00ffe3c917fa4c48e8c99589","endpointId":"bridge-return-remote-endpoint","id":"bridge-return-remote-pinset","pins":["d3a38bf13abc47f00c1adbf2dbf64f178da06abcda97f187364e9c10ceece3ad","87360050c67adeb4f30e58d4374f37dfd29b8f1005a6d56d30b556080b21a5a3"],"synthetic":true},{"algorithm":"sha256","commitment":"ad03e1bfe4dafd1327476809f5604c2123d62c95d31d16c371455ee88a38083b","endpointId":"restricted-review-remote-endpoint","id":"restricted-review-remote-pinset","pins":["53e0b6093f4235648815b8d96a7e2110526fab9e6ef7a0e2a00f7fd42b4fc1f4","74191c71dc0ec6c77f630db9e0a698ac48c5cec3f6b0759c27b4031db1b482ae"],"synthetic":true}],"principals":[{"authenticator":{"fingerprintAlgorithm":"sha256","keyId":"l0-local-authority-key-v1","kind":"asymmetric-key","publicKeyFingerprint":"0ba55dfe9ed041c458a1da389d2f0468f5d655dc4ea335a72a366ff3f8a2e072","synthetic":true},"controlDomainId":"local-root-control","id":"l0-local-authority","identityRoot":"synthetic:idp-a2:l0-local-authority","operationalState":"planned","role":"local-root","rootAuthority":true},{"authenticator":{"fingerprintAlgorithm":"sha256","keyId":"bridge-out-origin-key-v1","kind":"asymmetric-key","publicKeyFingerprint":"aa80fc5212ee3609e889d16f1c42b68a6532322d0c5f9655b891bb11cb676d42","synthetic":true},"controlDomainId":"bridge-out-local-control","id":"bridge-out-origin","identityRoot":"synthetic:idp-a2:bridge-out-origin","operationalState":"planned","role":"bridge-origin","rootAuthority":false},{"authenticator":{"fingerprintAlgorithm":"sha256","keyId":"bridge-out-peer-key-v1","kind":"asymmetric-key","publicKeyFingerprint":"49d89157798acfff01dc983cfd5e85f5644e2634b15c2eb0a60e2b41976c59c7","synthetic":true},"controlDomainId":"bridge-out-remote-control","id":"bridge-out-peer","identityRoot":"synthetic:idp-a2:bridge-out-peer","operationalState":"planned","role":"bridge-peer","rootAuthority":false},{"authenticator":{"fingerprintAlgorithm":"sha256","keyId":"bridge-return-receiver-key-v1","kind":"asymmetric-key","publicKeyFingerprint":"3f9fb0498b48c86e7ba5fd23aa4c22feda5ad63ece832e91da30225ca8e0adfd","synthetic":true},"controlDomainId":"bridge-return-local-control","id":"bridge-return-receiver","identityRoot":"synthetic:idp-a2:bridge-return-receiver","operationalState":"planned","role":"bridge-return-receiver","rootAuthority":false},{"authenticator":{"fingerprintAlgorithm":"sha256","keyId":"bridge-return-peer-key-v1","kind":"asymmetric-key","publicKeyFingerprint":"52fae22c03392ffb96d394d33198ef32242b0a97fc648d063fcf5dac4c70c401","synthetic":true},"controlDomainId":"bridge-return-remote-control","id":"bridge-return-peer","identityRoot":"synthetic:idp-a2:bridge-return-peer","operationalState":"planned","role":"bridge-return-peer","rootAuthority":false},{"authenticator":{"fingerprintAlgorithm":"sha256","keyId":"restricted-review-origin-key-v1","kind":"asymmetric-key","publicKeyFingerprint":"7cd5d7150a8876bb8ea607929c16f06cdb00bc37e77bedcc4fb785ffc8ae6c9a","synthetic":true},"controlDomainId":"restricted-review-local-control","id":"restricted-review-origin","identityRoot":"synthetic:idp-a2:restricted-review-origin","operationalState":"planned","role":"restricted-review-origin","rootAuthority":false},{"authenticator":{"fingerprintAlgorithm":"sha256","keyId":"restricted-review-peer-key-v1","kind":"asymmetric-key","publicKeyFingerprint":"41bb238a988d06f4b48467d683f063d6e89ae91a6085f9c6ac34f9cc1c96886b","synthetic":true},"controlDomainId":"restricted-review-remote-control","id":"restricted-review-peer","identityRoot":"synthetic:idp-a2:restricted-review-peer","operationalState":"planned","role":"restricted-review-peer","rootAuthority":false}],"profileState":"draft","registryScope":"structural-only","rules":{"bridgeCannotAssertRootAuthority":true,"contextCommitmentRequired":true,"crossRouteEndpointReuseForbidden":true,"crossRoutePinsetReuseForbidden":true,"crossRoutePrincipalReuseForbidden":true,"crossRouteTransportReuseForbidden":true,"d5BridgeTransportForbidden":true,"directionBindingRequired":true,"endpointPrincipalBindingRequired":true,"operationalBindingRequiresNonSyntheticAuthenticatorAndPins":true,"principalRoleBindingRequired":true,"remotePinsetBindingRequired":true,"structuralAuthenticatorsMustBeSynthetic":true,"structuralLocatorsMustRemainUnbound":true,"transportChannelBindingRequired":true},"sourceA1":{"head":"ec352636690ee22135cfc7a3d3e2067ee323f2cf","policyBlobSha":"7aac9aa7223eadd3739c0b59d4275eeed58bb3d1","policyPath":"conformance/idp-policy.json"},"standard":"EIGIIB-IDP-A2-0.1","transportProfiles":[{"channelBindingRequired":true,"channelId":"private-bridge-out","confidentialityRequired":true,"direction":"outbound","endpointPinningRequired":true,"id":"bridge-out-transport-v1","integrityRequired":true,"operationalState":"planned","peerAuthentication":"mutual-asymmetric","protocolFamily":"ssh"},{"channelBindingRequired":true,"channelId":"private-bridge-return","confidentialityRequired":true,"direction":"inbound","endpointPinningRequired":true,"id":"bridge-return-transport-v1","integrityRequired":true,"operationalState":"planned","peerAuthentication":"mutual-asymmetric","protocolFamily":"ssh"},{"channelBindingRequired":true,"channelId":"restricted-review","confidentialityRequired":true,"direction":"bidirectional","endpointPinningRequired":true,"id":"restricted-review-transport-v1","integrityRequired":true,"operationalState":"planned","peerAuthentication":"mutual-asymmetric","protocolFamily":"tls"}]}
